{
  "site": "127.0.0.1:34559",
  "audited_at": "2026-09-07T14:11:47Z",
  "summary": {
    "total_findings": 35,
    "critical": 0,
    "high": 12,
    "medium": 21,
    "low": 1,
    "info": 1,
    "overall_score": 10.5,
    "readiness_band": "critical",
    "discoverability_score": 8.4,
    "engagement_score": 0.0,
    "by_pillar": {
      "engagement": 7,
      "entity": 6,
      "freshness_corroboration": 3,
      "crawl_render": 6,
      "machine_readability": 8,
      "answerability": 5
    },
    "by_dimension": {
      "discoverability": 23,
      "engagement": 7,
      "answerability": 5
    },
    "coverage_state": "content",
    "specialist_coverage": "complete",
    "score_basis": "content and transport evidence from 7 parsed content page(s) (1 further fetched page(s) - search, account or navigation/reference endpoints - carry no content claim), sampled from 9 URL(s) the site advertises (page cap 40).",
    "headline": "127.0.0.1:34559 is reachable, but 12 high-severity gap(s) weaken how readily its facts can be quoted from the pages sampled."
  },
  "findings": [
    {
      "id": "F-001",
      "rule_id": "EG-DEEPLINK-REDIRECTED-HOME",
      "title": "Deep links are redirected to the home page",
      "severity": "high",
      "pillar": "engagement",
      "pillar_label": "Engagement & comparison readiness",
      "dimension": "engagement",
      "confidence": 0.9,
      "confidence_level": "high",
      "sampling": {
        "kind": "site_wide",
        "affected": 1,
        "sampled": null,
        "unit": "sampled page(s)",
        "coverage": null,
        "basis": "site-wide observation"
      },
      "source_skill": "engagement-audit",
      "evidence": "1 requested URL(s) ended at a front door after a redirect: a deep path ended at the site root (e.g. http://127.0.0.1:34559/products/legacy-model.html -> http://127.0.0.1:34559/).",
      "observation": "1 requested URL(s) ended at a front door after a redirect: a deep path ended at the site root (e.g. http://127.0.0.1:34559/products/legacy-model.html -> http://127.0.0.1:34559/).",
      "interpretation": "A URL that resolves to the home page carries none of the specificity the original link promised, so anything that cited the deep link now points at a generic landing page. A crawler that requests arbitrary paths under this host also receives 200 for all of them, which can make retired URLs look live. This audit observed the redirects; it does not measure how any particular index treats them.",
      "evidence_items": [
        {
          "kind": "observation",
          "observation": "http://127.0.0.1:34559/products/legacy-model.html redirected to http://127.0.0.1:34559/ (2 hop(s))",
          "url": "http://127.0.0.1:34559/products/legacy-model.html",
          "locator": "redirect chain"
        }
      ],
      "affected_urls": [
        "http://127.0.0.1:34559/products/legacy-model.html"
      ],
      "affected_url_count": 1,
      "metrics": {
        "scope": "site",
        "affected": 1,
        "cross_domain": 0,
        "priority_score": 64.8
      },
      "tags": [
        "continuity",
        "redirects"
      ],
      "suggested_action": {
        "summary": "Stop collapsing unknown or retired URLs onto the home page.",
        "priority": "high",
        "mechanism": "A home-page catch-all breaks the continuity between the answer and the visit, and it means arbitrary URLs under the host return 200 rather than 404, so retired addresses stay indistinguishable from live ones.",
        "verification": "Each URL listed resolves to its own content or returns 404.",
        "verification_type": "self_verifiable",
        "effort": "low",
        "impact": "high",
        "steps": [
          "Redirect a retired product to its closest live replacement, not to the home page.",
          "If there is no replacement, return 404/410 with a helpful page.",
          "Never use a catch-all rewrite for unmatched routes."
        ]
      },
      "priority_rank": 1
    },
    {
      "id": "F-002",
      "rule_id": "EN-NAME-INCONSISTENT",
      "title": "The brand is called different things in different places on its own site",
      "severity": "high",
      "pillar": "entity",
      "pillar_label": "Entity clarity & disambiguation",
      "dimension": "discoverability",
      "confidence": 0.8,
      "confidence_level": "medium",
      "sampling": {
        "kind": "site_wide",
        "affected": null,
        "sampled": null,
        "unit": "sampled page(s)",
        "coverage": null,
        "basis": "site-wide observation"
      },
      "source_skill": "entity-audit",
      "evidence": "2 materially different trading names are declared across the site's own metadata: \"Northvale\" (schema.org Organization/Brand name); \"Kitchenware Direct\" (og:site_name). (1 further name(s) are declared in a non-trading role and are not counted as conflicting: \"northvale.example\" (social).)",
      "observation": "2 materially different trading names are declared across the site's own metadata: \"Northvale\" (schema.org Organization/Brand name); \"Kitchenware Direct\" (og:site_name). (1 further name(s) are declared in a non-trading role and are not counted as conflicting: \"northvale.example\" (social).)",
      "interpretation": "Every distinct spelling of a name is a candidate for a separate entity. Where the site itself uses several for the same organisation, nothing in its markup states that they are one, so a reader has to infer it. Names that belong to a department, a subsidiary, a product brand or a localized version of the site are classified as such and are not counted here.",
      "evidence_items": [
        {
          "kind": "observation",
          "observation": "brand name \"Northvale\" declared in schema.org Organization/Brand name",
          "url": "http://127.0.0.1:34559/",
          "locator": "schema.org Organization/Brand name"
        },
        {
          "kind": "observation",
          "observation": "brand name \"Kitchenware Direct\" declared in og:site_name",
          "url": "http://127.0.0.1:34559/",
          "locator": "og:site_name"
        }
      ],
      "affected_urls": [
        "http://127.0.0.1:34559/"
      ],
      "affected_url_count": 1,
      "metrics": {
        "scope": "site",
        "distinct_names": 2,
        "excluded_related_names": [],
        "priority_score": 57.6
      },
      "tags": [
        "entity",
        "naming"
      ],
      "suggested_action": {
        "summary": "Pick one canonical brand string and use it byte-identically everywhere.",
        "priority": "high",
        "mechanism": "One exact string in Organization.name, og:site_name, the title suffix and Product.brand is an explicit statement that every mention is the same entity; several strings leave that to be inferred.",
        "verification": "Grep the rendered home page for the brand string; every occurrence should be identical.",
        "verification_type": "self_verifiable",
        "effort": "low",
        "impact": "high",
        "steps": [
          "Choose the exact trading name, including capitalisation and any suffix.",
          "Use it in Organization.name, og:site_name, the <title> suffix, the footer copyright and Product.brand.name.",
          "Put the legal entity name in legalName, not in name.",
          "Roll the same string out to every off-site profile."
        ]
      },
      "priority_rank": 2
    },
    {
      "id": "F-003",
      "rule_id": "FC-CROSS-PAGE-PRICE-CONFLICT",
      "title": "The same product is priced differently on the listing and on its own page",
      "severity": "high",
      "pillar": "freshness_corroboration",
      "pillar_label": "Freshness & corroboration",
      "dimension": "discoverability",
      "confidence": 0.9,
      "confidence_level": "high",
      "sampling": {
        "kind": "site_wide",
        "affected": null,
        "sampled": null,
        "unit": "sampled page(s)",
        "coverage": null,
        "basis": "site-wide observation"
      },
      "source_skill": "freshness-corroboration",
      "evidence": "1 product(s) carry different Offer.price values on a listing page and on the product page itself (e.g. 3999 on http://127.0.0.1:34559/collections/all.html vs 4499 on http://127.0.0.1:34559/products/northvale-kettle.html).",
      "observation": "1 product(s) carry different Offer.price values on a listing page and on the product page itself (e.g. 3999 on http://127.0.0.1:34559/collections/all.html vs 4499 on http://127.0.0.1:34559/products/northvale-kettle.html).",
      "interpretation": "Two prices for one product is an internal contradiction: nothing in the markup says which is current, so a reader of either page has no basis to pick. One source removes the disagreement.",
      "evidence_items": [
        {
          "kind": "observation",
          "observation": "listing price 3999 vs product-page price 4499",
          "url": "http://127.0.0.1:34559/collections/all.html",
          "locator": "compared against http://127.0.0.1:34559/products/northvale-kettle.html"
        }
      ],
      "affected_urls": [
        "http://127.0.0.1:34559/collections/all.html",
        "http://127.0.0.1:34559/products/northvale-kettle.html"
      ],
      "affected_url_count": 2,
      "metrics": {
        "scope": "site",
        "conflicts": 1,
        "priority_score": 54.0
      },
      "tags": [
        "consistency",
        "price"
      ],
      "suggested_action": {
        "summary": "Serve one price per product from a single source, on every surface.",
        "priority": "high",
        "mechanism": "Two prices for one product is an internal contradiction: nothing in the markup says which is current, so a reader of either page has no basis to pick. One source removes the disagreement.",
        "verification": "A crawl of every category page reports zero price mismatches against the linked product pages.",